Title,Price(£),Availability,Image URL
The Nameless City (The Nameless City #1),38.16,In stock,https://books.toscrape.com/media/cache/f4/79/f479de5f305c2ac0512702cf7155bb74.jpg
The Murder That Never Was (Forensic Instincts #5),54.11,In stock,https://books.toscrape.com/media/cache/dc/44/dc44f8e2aebac48ca8553814d9b021a8.jpg
The Most Perfect Thing: Inside (and Outside) a Bird's Egg,42.96,In stock,https://books.toscrape.com/media/cache/d4/8d/d48d5122a15347e9fe2b15ad354d69bf.jpg
"The Mindfulness and Acceptance Workbook for Anxiety: A Guide to Breaking Free from Anxiety, Phobias, and Worry Using Acceptance and Commitment Therapy",23.89,In stock,https://books.toscrape.com/media/cache/f8/6d/f86d08178e3788563ac17be5aefd29f0.jpg
The Life-Changing Magic of Tidying Up: The Japanese Art of Decluttering and Organizing,16.77,In stock,https://books.toscrape.com/media/cache/95/64/95647d6a526bf54120b9445e124794e1.jpg
"The Inefficiency Assassin: Time Management Tactics for Working Smarter, Not Longer",20.59,In stock,https://books.toscrape.com/media/cache/75/dc/75dce2f5949b407161f37f0af249b018.jpg
The Gutsy Girl: Escapades for Your Life of Epic Adventure,37.13,In stock,https://books.toscrape.com/media/cache/64/15/641570cd7e7aded53c7d33d78a9629f1.jpg
The Electric Pencil: Drawings from Inside State Hospital No. 3,56.06,In stock,https://books.toscrape.com/media/cache/2e/23/2e236e23ad52aa74505f224f6552eda8.jpg
The Death of Humanity: and the Case for Life,58.11,In stock,https://books.toscrape.com/media/cache/71/df/71df730cf38c232ee58a2e407135f055.jpg
"The Bulletproof Diet: Lose up to a Pound a Day, Reclaim Energy and Focus, Upgrade Your Life",49.05,In stock,https://books.toscrape.com/media/cache/ee/3e/ee3e219d23e73ba71c79b700f183aaed.jpg
The Art Forger,40.76,In stock,https://books.toscrape.com/media/cache/70/fa/70fa6c0437d9c97dbeada6bd32bf9d2c.jpg
The Age of Genius: The Seventeenth Century and the Birth of the Modern Mind,19.73,In stock,https://books.toscrape.com/media/cache/2d/4e/2d4e358712e6c9f1d3bdd78d1a16e5a8.jpg
The Activist's Tao Te Ching: Ancient Advice for a Modern Revolution,32.24,In stock,https://books.toscrape.com/media/cache/96/db/96db61bb53930c560fb4c1c62b583816.jpg
Spark Joy: An Illustrated Master Class on the Art of Organizing and Tidying Up,41.83,In stock,https://books.toscrape.com/media/cache/f3/4f/f34ffb24cc21c9f9f52dad4fd8f3ac21.jpg
Soul Reader,39.58,In stock,https://books.toscrape.com/media/cache/69/85/69852567cf97264a1442cbc882c84903.jpg
Security,39.25,In stock,https://books.toscrape.com/media/cache/da/df/dadfac66a89774b46b10225362724c83.jpg
"Saga, Volume 6 (Saga (Collected Editions) #6)",25.02,In stock,https://books.toscrape.com/media/cache/43/ae/43aee83ebb31e2122a7215e413770e5c.jpg
"Saga, Volume 5 (Saga (Collected Editions) #5)",51.04,In stock,https://books.toscrape.com/media/cache/e1/ea/e1ea6cb36e62ae6dc7b805f68ab9a700.jpg
Reskilling America: Learning to Labor in the Twenty-First Century,19.83,In stock,https://books.toscrape.com/media/cache/97/f8/97f8debeeaaece9603267653076e760f.jpg
"Rat Queens, Vol. 3: Demons (Rat Queens (Collected Editions) #11-15)",50.4,In stock,https://books.toscrape.com/media/cache/f3/ef/f3efd43ae0fa85d9b325d5e8783e7af5.jpg
